{
  "runId": "local-1779217531454",
  "dealId": "parkview-2026-001",
  "updatedAt": "2026-05-19T19:05:31.625Z",
  "documents": [
    {
      "docId": "due-diligence:rent-roll-analyst:workpaper-v1",
      "runId": "local-1779217531454",
      "dealId": "parkview-2026-001",
      "phase": "due-diligence",
      "agent": "rent-roll-analyst",
      "docType": "workpaper",
      "title": "rent-roll-analyst Workpaper",
      "path": "data/examples/parkview-2026-001/reports/due-diligence/rent-roll-analyst-workpaper-v1.md",
      "mime": "text/markdown",
      "version": 1,
      "summary": "Validated 200 units and rent strata.",
      "dependsOn": [],
      "tags": [
        "due-diligence",
        "rent-roll-analyst",
        "workpaper",
        "agent",
        "workpaper"
      ],
      "status": "final",
      "createdAt": "2026-05-19T19:05:31.490Z"
    },
    {
      "docId": "due-diligence:opex-analyst:workpaper-v1",
      "runId": "local-1779217531454",
      "dealId": "parkview-2026-001",
      "phase": "due-diligence",
      "agent": "opex-analyst",
      "docType": "workpaper",
      "title": "opex-analyst Workpaper",
      "path": "data/examples/parkview-2026-001/reports/due-diligence/opex-analyst-workpaper-v1.md",
      "mime": "text/markdown",
      "version": 1,
      "summary": "Expense ratio at 50.5%.",
      "dependsOn": [],
      "tags": [
        "due-diligence",
        "opex-analyst",
        "workpaper",
        "agent",
        "workpaper"
      ],
      "status": "final",
      "createdAt": "2026-05-19T19:05:31.497Z"
    },
    {
      "docId": "due-diligence:physical-inspection:workpaper-v1",
      "runId": "local-1779217531454",
      "dealId": "parkview-2026-001",
      "phase": "due-diligence",
      "agent": "physical-inspection",
      "docType": "workpaper",
      "title": "physical-inspection Workpaper",
      "path": "data/examples/parkview-2026-001/reports/due-diligence/physical-inspection-workpaper-v1.md",
      "mime": "text/markdown",
      "version": 1,
      "summary": "Capex schedule drafted across five-year horizon.",
      "dependsOn": [],
      "tags": [
        "due-diligence",
        "physical-inspection",
        "workpaper",
        "agent",
        "workpaper"
      ],
      "status": "final",
      "createdAt": "2026-05-19T19:05:31.502Z"
    },
    {
      "docId": "due-diligence:legal-title-review:workpaper-v1",
      "runId": "local-1779217531454",
      "dealId": "parkview-2026-001",
      "phase": "due-diligence",
      "agent": "legal-title-review",
      "docType": "workpaper",
      "title": "legal-title-review Workpaper",
      "path": "data/examples/parkview-2026-001/reports/due-diligence/legal-title-review-workpaper-v1.md",
      "mime": "text/markdown",
      "version": 1,
      "summary": "Title clear with standard exceptions.",
      "dependsOn": [],
      "tags": [
        "due-diligence",
        "legal-title-review",
        "workpaper",
        "agent",
        "workpaper"
      ],
      "status": "final",
      "createdAt": "2026-05-19T19:05:31.508Z"
    },
    {
      "docId": "due-diligence:market-study:workpaper-v1",
      "runId": "local-1779217531454",
      "dealId": "parkview-2026-001",
      "phase": "due-diligence",
      "agent": "market-study",
      "docType": "workpaper",
      "title": "market-study Workpaper",
      "path": "data/examples/parkview-2026-001/reports/due-diligence/market-study-workpaper-v1.md",
      "mime": "text/markdown",
      "version": 1,
      "summary": "Market cap range 0.05-0.065.",
      "dependsOn": [],
      "tags": [
        "due-diligence",
        "market-study",
        "workpaper",
        "agent",
        "workpaper"
      ],
      "status": "final",
      "createdAt": "2026-05-19T19:05:31.513Z"
    },
    {
      "docId": "due-diligence:tenant-credit:workpaper-v1",
      "runId": "local-1779217531454",
      "dealId": "parkview-2026-001",
      "phase": "due-diligence",
      "agent": "tenant-credit",
      "docType": "workpaper",
      "title": "tenant-credit Workpaper",
      "path": "data/examples/parkview-2026-001/reports/due-diligence/tenant-credit-workpaper-v1.md",
      "mime": "text/markdown",
      "version": 1,
      "summary": "Tenant delinquency and retention benchmarks evaluated.",
      "dependsOn": [],
      "tags": [
        "due-diligence",
        "tenant-credit",
        "workpaper",
        "agent",
        "workpaper"
      ],
      "status": "final",
      "createdAt": "2026-05-19T19:05:31.518Z"
    },
    {
      "docId": "due-diligence:environmental-review:workpaper-v1",
      "runId": "local-1779217531454",
      "dealId": "parkview-2026-001",
      "phase": "due-diligence",
      "agent": "environmental-review",
      "docType": "workpaper",
      "title": "environmental-review Workpaper",
      "path": "data/examples/parkview-2026-001/reports/due-diligence/environmental-review-workpaper-v1.md",
      "mime": "text/markdown",
      "version": 1,
      "summary": "No material environmental constraints.",
      "dependsOn": [],
      "tags": [
        "due-diligence",
        "environmental-review",
        "workpaper",
        "agent",
        "workpaper"
      ],
      "status": "final",
      "createdAt": "2026-05-19T19:05:31.523Z"
    },
    {
      "docId": "due-diligence:phase-orchestrator:due-diligence-output-v1",
      "runId": "local-1779217531454",
      "dealId": "parkview-2026-001",
      "phase": "due-diligence",
      "agent": "phase-orchestrator",
      "docType": "due-diligence-output",
      "title": "Due Diligence Structured Output",
      "path": "data/examples/parkview-2026-001/phase-outputs/due-diligence-output.json",
      "mime": "application/json",
      "version": 1,
      "summary": "Structured due diligence data for downstream phases",
      "dependsOn": [],
      "tags": [
        "due-diligence",
        "phase-orchestrator",
        "due-diligence-output",
        "phase-output"
      ],
      "status": "final",
      "createdAt": "2026-05-19T19:05:31.526Z"
    },
    {
      "docId": "due-diligence:phase-orchestrator:due-diligence-report-v1",
      "runId": "local-1779217531454",
      "dealId": "parkview-2026-001",
      "phase": "due-diligence",
      "agent": "phase-orchestrator",
      "docType": "due-diligence-report",
      "title": "Due Diligence Phase Report",
      "path": "data/examples/parkview-2026-001/reports/due-diligence-report.md",
      "mime": "text/markdown",
      "version": 1,
      "summary": "Due Diligence narrative report with findings, risks, and gaps",
      "dependsOn": [],
      "tags": [
        "due-diligence",
        "phase-orchestrator",
        "due-diligence-report",
        "phase-report"
      ],
      "status": "final",
      "createdAt": "2026-05-19T19:05:31.527Z"
    },
    {
      "docId": "underwriting:financial-model-builder:workpaper-v1",
      "runId": "local-1779217531454",
      "dealId": "parkview-2026-001",
      "phase": "underwriting",
      "agent": "financial-model-builder",
      "docType": "workpaper",
      "title": "financial-model-builder Workpaper",
      "path": "data/examples/parkview-2026-001/reports/underwriting/financial-model-builder-workpaper-v1.md",
      "mime": "text/markdown",
      "version": 1,
      "summary": "Base-case model calibrated and validated.",
      "dependsOn": [],
      "tags": [
        "underwriting",
        "financial-model-builder",
        "workpaper",
        "agent",
        "workpaper"
      ],
      "status": "final",
      "createdAt": "2026-05-19T19:05:31.536Z"
    },
    {
      "docId": "underwriting:scenario-analyst:workpaper-v1",
      "runId": "local-1779217531454",
      "dealId": "parkview-2026-001",
      "phase": "underwriting",
      "agent": "scenario-analyst",
      "docType": "workpaper",
      "title": "scenario-analyst Workpaper",
      "path": "data/examples/parkview-2026-001/reports/underwriting/scenario-analyst-workpaper-v1.md",
      "mime": "text/markdown",
      "version": 1,
      "summary": "1/27 sensitivity scenarios pass constraints.",
      "dependsOn": [],
      "tags": [
        "underwriting",
        "scenario-analyst",
        "workpaper",
        "agent",
        "workpaper"
      ],
      "status": "final",
      "createdAt": "2026-05-19T19:05:31.541Z"
    },
    {
      "docId": "underwriting:ic-memo-writer:workpaper-v1",
      "runId": "local-1779217531454",
      "dealId": "parkview-2026-001",
      "phase": "underwriting",
      "agent": "ic-memo-writer",
      "docType": "workpaper",
      "title": "ic-memo-writer Workpaper",
      "path": "data/examples/parkview-2026-001/reports/underwriting/ic-memo-writer-workpaper-v1.md",
      "mime": "text/markdown",
      "version": 1,
      "summary": "Investment memo with conditions and downside protections drafted.",
      "dependsOn": [],
      "tags": [
        "underwriting",
        "ic-memo-writer",
        "workpaper",
        "agent",
        "workpaper"
      ],
      "status": "final",
      "createdAt": "2026-05-19T19:05:31.547Z"
    },
    {
      "docId": "underwriting:phase-orchestrator:underwriting-output-v1",
      "runId": "local-1779217531454",
      "dealId": "parkview-2026-001",
      "phase": "underwriting",
      "agent": "phase-orchestrator",
      "docType": "underwriting-output",
      "title": "Underwriting Structured Output",
      "path": "data/examples/parkview-2026-001/phase-outputs/underwriting-output.json",
      "mime": "application/json",
      "version": 1,
      "summary": "Structured underwriting data for downstream phases",
      "dependsOn": [],
      "tags": [
        "underwriting",
        "phase-orchestrator",
        "underwriting-output",
        "phase-output"
      ],
      "status": "final",
      "createdAt": "2026-05-19T19:05:31.550Z"
    },
    {
      "docId": "underwriting:phase-orchestrator:underwriting-report-v1",
      "runId": "local-1779217531454",
      "dealId": "parkview-2026-001",